{
  "version": "2026-08-06",
  "source": "archives.gov/cui/registry",
  "retrieved": "2026-08-06",
  "groups": [
    "Critical Infrastructure",
    "Defense",
    "Export Control",
    "Financial",
    "Immigration",
    "Intelligence",
    "International Agreements",
    "Law Enforcement",
    "Legal",
    "Natural and Cultural Resources",
    "North Atlantic Treaty Organization (NATO)",
    "Nuclear",
    "Patent",
    "Privacy",
    "Procurement and Acquisition",
    "Proprietary Business Information",
    "Provisional",
    "Statistical",
    "Tax",
    "Transportation"
  ],
  "categories": [
    {
      "name": "Status Adjustment",
      "category_marking": "ADJ",
      "banner_marking": "CUI",
      "alternative_banner_marking": "CUI//ADJ",
      "group": "Immigration",
      "description": "Related to applications for the adjustment of immigration status.",
      "authorities": [
        {
          "citation": "8 USC 1160(b)",
          "classification": "Basic",
          "banner_marking": "CUI",
          "sanctions": "8 USC 1160(b)(6)(D)"
        },
        {
          "citation": "8 USC 1255a(c)",
          "classification": "Basic",
          "banner_marking": "CUI",
          "sanctions": "8 USC 1255a(c)(5)(E)"
        }
      ],
      "last_reviewed": "July 25, 2025",
      "source_url": "https://www.archives.gov/cui/registry/category-detail/status-adjustment"
    },
    {
      "name": "Administrative Proceedings",
      "category_marking": "ADPO",
      "banner_marking": null,
      "alternative_banner_marking": "CUI//ADPO",
      "group": "Legal",
      "description": "Adjudication of agency-related matters including, but not limited to, dispute resolution, settlements, and issuances of orders.",
      "authorities": [
        {
          "citation": "5 USC 574",
          "classification": "Basic",
          "banner_marking": "CUI",
          "sanctions": null
        },
        {
          "citation": "42 USC 2000e-8(e)",
          "classification": "Basic",
          "banner_marking": "CUI",
          "sanctions": "42 USC 2000e-8(e)"
        },
        {
          "citation": "16 CFR 3.45",
          "classification": "Specified",
          "banner_marking": "CUI//SP-ADPO",
          "sanctions": null
        },
        {
          "citation": "16 CFR 4.9(c)",
          "classification": "Basic",
          "banner_marking": "CUI",
          "sanctions": null
        },
        {
          "citation": "18 CFR 385.606",
          "classification": "Basic",
          "banner_marking": "CUI",
          "sanctions": null
        },
        {
          "citation": "29 CFR 2200.120(d)(3)",
          "classification": "Basic",
          "banner_marking": "CUI",
          "sanctions": null
        },
        {
          "citation": "8 CFR 292.3(h)",
          "classification": "Basic",
          "banner_marking": "CUI",
          "sanctions": null
        },
        {
          "citation": "42 USC 2000e-5(b)",
          "classification": "Basic",
          "banner_marking": "CUI",
          "sanctions": "42 USC 2000e-5(b)"
        },
        {
          "citation": "42 USC 3610(d)",
          "classification": "Basic",
          "banner_marking": "CUI",
          "sanctions": null
        },
        {
          "citation": "46 CFR 502.167",
          "classification": "Basic",
          "banner_marking": "CUI",
          "sanctions": null
        },
        {
          "citation": "17 CFR 11.3",
          "classification": "Basic",
          "banner_marking": "CUI",
          "sanctions": null
        },
        {
          "citation": "17 CFR 10.64",
          "classification": "Specified",
          "banner_marking": "CUI//SP-ADPO",
          "sanctions": null
        },
        {
          "citation": "29 CFR 1640.4",
          "classification": "Basic",
          "banner_marking": "CUI",
          "sanctions": null
        },
        {
          "citation": "29 CFR 1603.108(d)",
          "classification": "Basic",
          "banner_marking": "CUI",
          "sanctions": null
        }
      ],
      "last_reviewed": "May 12, 2025",
      "source_url": "https://www.archives.gov/cui/registry/category-detail/admin-proceedings"
    },
    {
      "name": "Agriculture",
      "category_marking": "AG",
      "banner_marking": "CUI",
      "alternative_banner_marking": "CUI//AG",
      "group": "Intelligence",
      "description": "Information related to the agricultural operation, farming or conservation practices, or the actual land of an agricultural producer or landowner.",
      "authorities": [
        {
          "citation": "7 USC 8791(b)",
          "classification": "Basic",
          "banner_marking": "CUI",
          "sanctions": null
        }
      ],
      "last_reviewed": "May 8, 2025",
      "source_url": "https://www.archives.gov/cui/registry/category-detail/agriculture"
    },
    {
      "name": "Accident Investigation",
      "category_marking": "AIV",
      "banner_marking": "CUI//SP-AIV",
      "alternative_banner_marking": null,
      "group": "Law Enforcement",
      "description": "Related to information obtained during the course of an accident or incident investigation. Including but not limited to information related to wreckage, records, mail, or cargo.",
      "authorities": [
        {
          "citation": "49 CFR Part 1114",
          "classification": "Specified",
          "banner_marking": "CUI//SP-AIV",
          "sanctions": null
        },
        {
          "citation": "49 CFR Part 831",
          "classification": "Specified",
          "banner_marking": "CUI//SP-AIV",
          "sanctions": null
        }
      ],
      "last_reviewed": "May 8, 2025",
      "source_url": "https://www.archives.gov/cui/registry/category-detail/accident-investigation"
    },
    {
      "name": "Patent Applications",
      "category_marking": "APP",
      "banner_marking": null,
      "alternative_banner_marking": "CUI//APP",
      "group": "Patent",
      "description": "Application for patent filed under 35 U.S.C. 111(a) that includes all types of patent applications (i.e., utility, design, plant, and reissue) except provisional applications. The nonprovisional application establishes the filing date and initiates the examination process. A nonprovisional utility patent application must include a specification, including a claim or claims; drawings, when necessary; an oath or declaration; and the prescribed filing fee.",
      "authorities": [
        {
          "citation": "35 USC 122(a)",
          "classification": "Basic",
          "banner_marking": "CUI",
          "sanctions": "35 USC 186 35 USC 187"
        },
        {
          "citation": "35 USC 205",
          "classification": "Basic",
          "banner_marking": "CUI",
          "sanctions": "35 USC 186 35 USC 187"
        },
        {
          "citation": "37 CFR 401.13(c)(2)",
          "classification": "Basic",
          "banner_marking": "CUI",
          "sanctions": null
        }
      ],
      "last_reviewed": "July 29, 2025",
      "source_url": "https://www.archives.gov/cui/registry/category-detail/patent-application"
    },
    {
      "name": "Archaeological Resources",
      "category_marking": "ARCHR",
      "banner_marking": "CUI//ARCHR",
      "alternative_banner_marking": "CUI//ARCHR",
      "group": "Natural and Cultural Resources",
      "description": "Related to information about the nature and location of any archaeological resource for which the excavation or removal requires a permit or other permission.",
      "authorities": [
        {
          "citation": "16 USC 470hh",
          "classification": "Basic",
          "banner_marking": "CUI//ARCHR",
          "sanctions": null
        },
        {
          "citation": "43 CFR 7.18",
          "classification": "Basic",
          "banner_marking": "CUI//ARCHR",
          "sanctions": null
        }
      ],
      "last_reviewed": "May 8, 2025",
      "source_url": "https://www.archives.gov/cui/registry/category-detail/archaeological-resources"
    },
    {
      "name": "Asylee",
      "category_marking": "ASYL",
      "banner_marking": "CUI",
      "alternative_banner_marking": "CUI//ASYL",
      "group": "Immigration",
      "description": "Related to refugee applications and associated hearings to grant asylum to foreign nationals in the United States to be recognized as asylees.",
      "authorities": [
        {
          "citation": "8 CFR 1208.6",
          "classification": "Basic",
          "banner_marking": "CUI",
          "sanctions": null
        },
        {
          "citation": "8 CFR 208.6",
          "classification": "Basic",
          "banner_marking": "CUI",
          "sanctions": null
        }
      ],
      "last_reviewed": "July 25, 2025",
      "source_url": "https://www.archives.gov/cui/registry/category-detail/asylee"
    },
    {
      "name": "Collective Bargaining",
      "category_marking": "BARG",
      "banner_marking": "CUI",
      "alternative_banner_marking": "CUI//BARG",
      "group": "Legal",
      "description": "Defining agencies' and representatives' duty to negotiate in good faith to include disclosure of certain labor relations training and guidance materials and limiting the issuance of certain subpoenas.",
      "authorities": [
        {
          "citation": "5 USC 7114(b)(4)(C)",
          "classification": "Basic",
          "banner_marking": "CUI",
          "sanctions": null
        }
      ],
      "last_reviewed": "May 8, 2025",
      "source_url": "https://www.archives.gov/cui/registry/category-detail/collective-bargaining"
    },
    {
      "name": "Battered Spouse or Child",
      "category_marking": "BATT",
      "banner_marking": "CUI",
      "alternative_banner_marking": null,
      "group": "Immigration",